중국 만평,"출처 RFA


진짜 중국 소비하지 말자 개개인이라도.
나는 마라탕도 한국인이 운영하는 것만 먹고 중국 자본이나 입김 들어간 철인왕후, 여신강림 일절 안 봄. 생각보다 더 심각하다",31,"['여신강림 네이버웹툰 원작 아니야?!', 'ㅇㅇ맞는데 중국 ppl로 떡칠해서 카페에서 훠궈 먹고 난리남. 네이버원작이어도 이번에 만들어지는 간 떨어지는 동거도 중국 자본 들어감. 중국 자본 들어가는 건 나는 아는 한에선 최대한 안 봐', '헐 웹툰도 보다 말아서 드라마 안 봣는데 카페에서 훠궈를 먹는다고....? ㅋㅋㅋㅋㅋㅋㅋㅋㅋㅋㅋㅋㅋㅋㅋ', '나도 마라탕 작년 말부터 불매중.. 진짜 어느 순간 훅 심해지지 않았냐 중국문화 억지 유행타는거? 어느순간 미디어 (특히유튭) 같은데서 피 대신 마라 흘러요, 하면서 마라 안먹으면 문찐 취급 하더니 탕후루까지 ㅋㅋㅋ', '나도 한국인이 하는 마라탕가게 아니면 안감 조선족 중국인들 한국에서 마라탕가게 차리고 한국인들한테는 체인 안내주고 자기들끼리 똘똘 뭉친다고 듣고 기분나빠서 안먹게 됨', '그리고 억지유행타는 거 ㅇㅈ 중국 드라마 소설이 언제부터 인기있었다고 ... 대부분이 안보는데 한국에서 인기있는 것처럼 영업하는 애들 커뮤에 존나 많음', '일본한테는 난리를 치면서 중국한테는 꼼짝못하지 아 ㅋㅋ']"
우주소녀 성소 근황아는사람?,예전에 그런얘기 들었던거같은데 우주소녀 중국인 멤버들 중국으로 돌아가서 거기서만 활동한다고? 갑자기 궁금해짐,0,"['ㅇㅇ걍 중국에서만 활동하고 항미원조 글이나 올리는 중국연예인임. 우주소녀 활동 안 하고 지금 한국활동 아예 안해서 한국어 아예 걍 퇴화함', 'ㅋㅋ한국에서 커서 중국에서 활동하면 돈은 지리게 벌긴하겠네']"
중국이랑 나치중에 어디가 더,개새끼냐?? 나치는 이미 없어졌는데 중국은ㅅㅂ 없어지지도 않는데 아 진짜 중국 제발 멸망했으면.....,0,"['도긴개긴', '비교 불가 나치 아님?', '지금 중국이 소수민족들한테 하는짓이 나치랑 똑같음', '지금까지야 비교불가 나치라고 할수있지. 근데 지금 중국이 세계에미치는 영향력, 하는짓, 앞으로의 성장성등을 보면 나중엔 나치 뺨후려칠 짓을해도 미국말곤 아무도 간섭못함', '힘 차이지. 중국이 나치만큼 힘이 세면 진짜 걔네만한 짓 이상도 할 수 있다고 봄', '나치 : 유태인 무차별 학살한 언럭키 유럽인 중국 : 모든 인종을 중국인으로 개조하려는 매드 컬쳐니스트']"
코로나,"점점 무섭게 왜 그러냐..
중국아 진짜 전세계에 무슨 짓을 한거야..",0,"['착해져라 늦지않았어....', '남아공 브라질 영국 핀란드... 인류 조졌다!', '훠훠 코로나는 인류모두의적이니 모든 인류가 반쉉해야하는거 아니겠슙니까? 저는 새해 문안인사드려야 햬셔 그럼 이만', '진단이 불가능하다는게 무슨말이지 걸렸는데도 진단할 수가 없다는겨...?', '변이가 일어나 기존의 pcr검사 진단시약으로는 판별이 불가능하다는 뜻', '세상에... 환장한다??????', '이거 진짜 전염병주식회사 아니냐.. 점점 더쎈걸로 찾아오는..']"
부끄럽지도 않나,"하긴 섬기니 고개를 조아리지
부끄러운 줄 알아라

중국 관영매체 '인민망 한국지사'
해당 영상들 싫어요 많이 달리고
호의적이지 않은 댓글 수두룩하자
좋아요 숨김 + 댓글 막음

중국 섬기는 일부 한국 정치인들
정말 싫다",8,['ㅋㅋㅋ 저새끼들이 친일파랑 다를게 뭐임?']
벨기에는 왜그렇게 축구를 잘할까,"축구 별로 관심없는데 항상 궁금함 국토도 우리나라 1/3?정도 밖에 안되고 인구수도 작고..그런데 어떻게 저렇게 잘하지?
중국이 축구 못하는 이유도 궁금하고..신기허다",0,"['15억 인구인데 축구 못하는 ‘그나라’', '와플 많이 먹어서', '벨기에도 꾸준히 잘한거 아니고, 암흑기 있었는데 유소년 정책 제대로 잘해서 잘해진거임 지금이 황금세대', '우리보다 인구수 적고 땅덩이 작은데 진짜 꾸준히 잘하는 나라로는 네덜란드가 더 적합할 듯', '그만큼 시스템이 잘 갖춰지신거지~', '인종차이 아시아인은 걍 축구 못하는듯', '아이슬란드도 33만으로 유로 8강 갔는데 신체적 차이가 큰가봐']"
중국의 이중성,"진짜 지금 소수민족인 위구르의 문화는 말살시키려하면서
속국이었던 적도 없는 한국 문화는 왜 앞장서서 지키려하는지",6,"['한국공격은 좀 결이 다름. 중국내 한국문화 인기많은거 부터 한류가 세계적으로 퍼지니 열등감 표출에 한국의 문화 베이스는 중국이니 한류도 결국 중국거라고 주장하고 싶은거임.', '중국의 빈약한 소프트웨어를 도둑질로 무마하겠다는 의지로 보는게 정설이야', '일본은 이미 옛날부터 유명해서 못건들고 있음. 한국은 이제와서 뜨기 시작하 글로벌 미디어 시대까지 겹쳐서 집중타겟대상으로 삼는거임.']"
와 이제 김연아도 조선족이라고 우기네,그냥 한국은 중국 자치구라고 하지 왜,2,['맞아']
난 솔직히 종종 중국이라는 그 큰 적을 냅두고,"왜 설글 정시수시 남녀 문과이과 등등으로 싸우는지 의문이야
그 어떤 것보다 중국이 더 쓰레기같지 않냐",41,"['난 중국이 더 와닿는데 중국 개싫어서 그런가', 'ㅋㅋㅋㅋ ㅇㅈ', '중국은 그냥 쓰레기라고 하기에도 뭐한게 존나 크고 지능이란게 없어 대왕 바퀴벌레같아', '일부러 중국인이 와서 어그로 풀어놓는 것도 몇 개 있을걸', '인정 일부가 맞춤법 개같이 쓰는데 낚이지말자 우리 뭔가 한국인 안같은 맞춤법실수~ 뭔지알지', 'ㅇㅇ 걔네 띄어쓰기도 ㅈㄴ 이상함 걍 그런 어그로 보이면 신고가 답임 빨리 정지먹여서 클ㅡ린한 에타 만들어야지', '띄어쓰기 둘째치고 뭔가 이상해 조사 쓰는것도 그렇고 문장에 위화감이들어. 한국인도 자주틀리는 맞춤법이면 신경안쓰이는데 읽다보면 뭐야? 스러운거 자주보임', '보통 남녀떡밥 가지고 키배 뜨는 애들 더 큰 문제들 얘기 하면 (중국. 경제. 정치 등등) 아 정치 얘기 하지마 이럼 ㅋㅋㅋㅋㅋㅋ걍 싸우는걸 즐기는 애들임', '+ 북한 안보 걱정하면 요즘 시대에 뭔 전쟁 걱정 하냐 함', 'ㄹㅇ... 대화해보면 논리가 없다고 해야하나 생각이 짧다고 해야하나..', 'USA????형님이 유럽 + 아시아태평양 동맹국들과 중국 참교육할 날이 얼마 남지 않았다', '아시아태평양' 지역 국가들의 비공식적 모임이라고 보면 됨. 대체로 미국의 편, 자유민주주의 국가, Rule of Law 지지 등]"
자 시작한다~,"새벽 훕케 아침 훕케 점심 남자 여자 군대 ㅋㅋㅋㅋㅋ
이제다음은 저녁에 중국인 얘기만 나오면 되는거지?",2,"['ㄴㄴ 설글 빠졌네', '아 ㅋㅋ 이미 나오고 있는거 같네 ㅋㅋㅋㅋ', '추합시즌이므로 입결도 같이', '입결 낮아 ㅜㅜ 건외 <ㅡ 100프로 나옴']"
중국인을 바퀴벌레와 비교하면,바퀴벌레한테 미안함ㅋㅋㅋㅋ,1,['둘다 해충인데 뭘ㅋㅋ 우열을 굳이']
미스 어스에 참가한 중국,"2020년 11월에 베트남 전통의상인 '아오자이(ao dai)'입고 참가했다고 해 당연히 베트남에서는 난리났고 ㅋㅋ
제작년 11월부터 베트남 전통의상 '아오자이'와 전통모자 '논라(non la)'가 중국 것이라고 주장한다고....

http://www.topstarnews.net/news/articleView.html?idxno=846640

물론 일본 기모노와 닌자도 이미 중국문화라고 주장한적이 있다고 해 하지만 워낙 일본이 미디어에 닌자로 한 창작물이 많아서 ㅋㅋ 중국풍에 닌자로 한 게임을 만들었지만 혼돈을 안해서 실패...",2,[]
중국의 침묵,한복 기모노 아오자이 다 내꺼야,19,['끼-룩']
중국의 전통 복장을 알아보자,짱- 인민복,24,"['진짜 줫같이도 생겼다들', '머리도 변발인 것들이 뭔 언제부터 갓을 쓰고다녔다고 난리야 진짜; 중국인들아 기억하자. 너네꺼는 딱 하나 뿐. 코로나']"
중국아,이참에 기모노도 중국전통의상이라고 우기지그러냐?ㅋㅋㅋ,16,"['일단 국가하나 집중타겟하는거임', '베트남옷도 지네꺼라하잖아', '이미 기모노를 모티브로 한푸를 만들었어 ㅋㅋㅋ 아니 중국애들 지네들도 한푸가 정확히 어떻게 생겼는지를 모르는것 같아 ㅋㅋ', '걔네 근본 자기들 손으로 박살내놓고 왜 여기서 기웃거리는건지 ㅉㅉ', 'ㅋㅋㅋㅋㅋㅋ런던 브릿지 표절 논란도 있잖아']"
무식한 한국놈들 한푸의 기원 공부좀 해라,알겠냐? 우리 대중국의 자랑스런 한푸의 기원을?,12,"['돌려까기잖아', '앗 ㅈㅅ', '심지어 공식적인 명칭에서 나온것도 아니었군 ㅋㅋㅋㅋ', '그럼 치파오는 어디 거냐 베트남?', 'ㅋㅋㅋ 베트남 아오자이도 중국꺼라 우기는걸로 알고 있는데?', '지네 거를 지네 손으로 다 불태웠으니 ... 근본도 없는 짱깨들 ㅇㅋ', '어휴 짱꼴라들..... 개극혐이다 진심....ㅠ']"
우리 이러다가 몽골이나 티벳꼴나는거임,"중국은 완벽한 자기만의 고유문화가 없어.
애초에 청나라고 뭐고 이민족이 지배했던적도 많은데 도대체 뭐가 중국이겠어
그냥 옛날부터 이거저거 다 흡수해가지고 나중에서야 하나로 묶겠다고 만든게 한족문화고 한족중심 통치임
일본이랑 다르게 걔네는 진심으로 자기들 문화라고 생각한다
나중에는 한국문화 자체도 지들 소수민족 문화라고 할 애들임..",35,"['걔네가 쓰는 보통화도 거즘 인공어잖아ㅋㅋㅋ 원래 지역마다 영어랑 독일어 수준으로 말이 안통했다던데ㅋㅋㅋ', '언어적으로야 뭐 지역이 워낙 방대하니까.. 근데 미국이랑 다르게 중국은 원치도 않는데 어차피 우리가 주인이야!라는 의식으로 흡수해버리는게 문제임', '솔직히 몇백년 지나면 흡수할거같음 ㅇㅇ', '옛날에야 중국이 내부적으로 수습하기 바쁘고 우리가 미국쪽에 붙어서 어느정도 국력 유지하니까 어찌 못했던거지 걔네는 마인드 자체가 우리는 동북아의 우두머리!라서 위치적으로도 그렇고 중국이 힘 더 키우고 이상한 놈이 주석되면 위험해..', '문화대혁명으로 지들 문화 지들 손으로 다 박살내서 남들 문화 탐내는 중 ㅋㅋㅋㅋ', '진짜 무섭다 ㅠ', '100년뒤 혹은 그 안으로 흡수당할거같긴해... 올해 신생아수 북한한테 역전당했대', '또렷한 근본이 없으면 중국처럼 사상이 위험해진다... 걔네들 주장이 한국이 중국 속국이었다인데 그렇게 따지면 본인들은 한족이 중국 대륙을 통치하던 역사가 얼마나 된다고.. 거란족, 여진족들이 지배하기도 했고, 일본 및 서양의 지배도 받았으면서 어디서 속국 타령이야. 태어나보니 땅덩어리가 넓고 조상들 덕에 먹고사는 놈들이']"
중국아,문화강탈할 생각말고 이런거나 협조 좀 해라,4,['ㄹㅇ 이러니까 욕쳐먹지']
중국 진짜ㅋㅋ,감히 여왕님을 건들다니,24,"['미친새끼들; 저거 주류의견임?ㅅㅂㅅㅂ', '에타 보면 정신병자들이 그 대학 집단의 극 소수잖음?? 근데 중국은 그 정신병자들이 다수를 차지하니까 미쳐가는거 같음. 결론은 뭐다? 착짱죽짱이다', '근데 뒤져도 더러워서 딱히 착해진건지는...', '대가리 깨졌네 단체로...', '지랄도 정도껏해야지']"
할말 잃음,"우리나라 언제 중국에 속했었냐 ㅋㅋㅋㅋㅋㅋㅋㅋㅋ
얘가 중국인 아니라는것도 안믿지만
진짜 중국인 아니면 큰일 아니냐....",0,"['너무 열 받는다', '중국이란 개념부터가 븅신같음ㅋㅋㅋ 수천년동안 계속 분열되고 이민족들한테 땅먹힌게 중국땅인데 그 수많은 문화 민족을 그냥 중국이란 한개념으로 퉁친다는게 참ㅋㅋㅋ', '애초에 북경이랑 상해랑 보통화 나오기전에 언어도 안통했다던데', '영어쓸거면 문법 좀 제대로 했으면 좋겠다 중국애들']"
진짜,김소현은 그냥 설날인사하면서 비하인드짤 올린거뿐인데 중국인들이 도배해서 당황했겠다,0,['사회악 진짜']
우리나라,"친중 친일도 당연히 싫지만 친미도 싫다..
중국의 속국이 되지않기위해 미국의 속국이 되어야하는 우리나라 현실이 참..슬프다",0,"['미국국기 흔들고 다니는건 좀 역하긴해', '진짜 전형적인 이분법, 흑백 논리 개역겨움. 특히 어른들은 친중아니면 친미여야 한다는 이분법적 논리에 너무 심각하게 빠져있는듯', '싫고좋고를 떠나서 살아남으려면 어쩔 수 없지', '미국의 52번째 주 되는것도 좋은디 ㅇㅅㅇ...', 불완전하더라도 한미(+일)은 자유민주주의?시장경제 라는 가치를 공유하는 동맹인데 거기서 빠져나오려고 기를 쓰면서 한국은 미국 속국이네, 일본은 민족의 적이네 어쩌네 하는게 딱 '그 진영' 하고 북한 중국 논리인데]"
말 안했음 중국방송인거 모를뻔했다..ㅋ,기가 차네,3,"['머선129', '중국방송이래..ㅋㅋㅋㅋㅋ', '진짜 저 종족은 염치라는게 존재할까?', '미친놈들 드디어 360도 쳐돌아서 한국의 속국이 되고싶은건가? 아 안사요 바퀴벌레같은놈들아;;;', '한복촌스러운거봐라', '도대체 짱깨들이 언제부터 한복을 입은거임?ㅋㅋ', '치파오나 입지 왜 저래', '긍까..', '진심 큰일이다..', '와 진짜 이정도면 짱깨라는 말 들어도 할말없는거아니냐?']"
공항 경찰로 근무하면서 중국인이 ㅈ같았던점,"상황1. 궁금한게 있다

다른 외국인 : 영어로 물어보거나 휴대폰 번역기를 사용하는 등 상대방과 의사소통을 위해 노력한다

중국인 : 중국어만 쓴다. 상대방이 알아듣던 말던 걍 중국어로 끝까지 씨부린다

상황2. 비행기가 결항됐다

다른 외국인 : 상황이 어쩔 수 없음을 인정하고 보상만 만족하면 돌아간다

중국인 : 떼쓴다. 태풍이 불건 활주로가 얼어붙었던 무조건 비행기 띄우란다. 답이 없음ㅅㅂ

상황3. 일이 있어서 특정 구역 출입을 통제한다

다른 외국인 : 무슨 일이 있겠지 하면서 알아서 피해간다

중국인 : 꼭 그 쪽으로 들어갈려고 한다. 막으면 또 알아들을 수 없는 중국어로 씨부린다

(중국인 혐오 맞다ㅇㅇ 1년 8개월 공항경찰로 군생활했는데 부대원 전부 중국인 혐오생김)",9,"['ㅇㅈ 기동대 중국대사관 시설근무서면 ㄹㅇ답이없음ㅋㅋ', '착짱은 뭐다?']"
근데 중국한테 인사하는건 어쩔 수 없는거 아니냐?,"내수가 어마어마한데 눈치를 안빨수가있나 외대에서 저거 가지고 뭐라고할 줄은 몰랐네. 우리집도 문ㅈㅇ 때문에 임대사업자 과태료 3천만 쳐 맞아서 기분같아선 바로 광화문 행인데, 바로 옆에 있는데 중국 눈치 안보기도 좀 그렇지 않냐.",2,"['대통령은 모르겠는데 옆에 떨거지들이 이번에 왜 잔뜩 빠는가 묻는거아님?', '베트남도 있어 그래서 베트남어로도함', '아 ㅋㅋㅋ 공산당 100년 축하해준것도 눈치보는거임?', '중국 빠는게 그렇게 잘 못 된거인지 모르겠다는 거임 힘없는 나라에서 외줄타기 하느니 두발 다 걸쳐 놓는게 맞지 않냐고', '지금 두발 다 안걸쳐놓은게 문제죠 우리나라는 기본적으로 자본주의 민주주의 국가인데 자꾸 미국이랑 어긋나는 외교 행보를 노골적으로 보이고 공산당 100주년 축하하는게 썩 안좋아보입니다만', '한국의 수천년 역사+ 한국전쟁까지 중국이 한 짓 생각해보면 정이 안 갈 뿐 아니라 역사는 과거라 치더라도 최근의 문화 동북공정은 국민들에게 있어 반감을 당연히 가지게 하죠', '어떤부분이 노골적으로 미국에 어긋나는거?', '공산당 100주년 축하한다는 발언부터가 문제죠 중국 공산당의 가장 큰 문제점으로 꼽히고 있는게 인권 탄압- 홍콩이나 신장위구르 자치구에서 탄압 인데 미국의 우방국인 한국이, 민주주의 국가의 정상이 옹호한 것으로 받아들여져 미국에서도 의문이라는 말들도 많고요', '동맹으로 중국 견제한다는 바이든 정부의 대중 외교 전략이랑도 한참은 어긋나는 발언으로 보입니다만.. 일본에서도 왜? 하는 반응들이 많았고요. 일본 언론에서는 중국에 속지마라 라는 말들까지 나왔어요. 한국에 서희같은 지략가가 있는 것도 아니고.. 현 상황에서 편의주의 외교는 불가능하다고 생각합니다', ' 어쩔수 없다 라는 말로 어디까지 합리화 할건지가 참 무서운것 같아요. 코로나 초기 입국 봉쇄부터 공산당 100주년 축하까지.. ㅋㅋㅋ대중 무역 의존도로 따지자면 대만도 우리나라 못지 않게 심했는데. 친미 기조로 돌아선 현재의 대만을 보세요. 최근 미국과 대만이 손잡고 반도체 공급망 개선 및 R&D·인재육성 등 협력 강화한다는 뉴스도 봤어요.', '애초에 tsmc가 d램 점유율이 절반가까운데요. 대만은 낸드쪽에서 확실한 선두주자에요. 하이닉스 삼성합쳐도 안되는 점유율인데;', '물론 그런 부분도 영향이 있겠죠 ㅋㅋㅋㅋ 근데 바이든 국무부가 대만과의 회담 사실 공개하며 \'민주주의 국가·파트너\' 대만과 유대관계 강화 이라고 한것도 보셨어요?', '애초에 반도체 산업은 국제 공조가 중요한 분야인데 이재용은 감방가있고 ㅋㅋㅋ.. 국내 반도체 회사들이 미국, 일본과 협력하는 것이 점점 더 어려워질 수 밖에 없겠죠 진심으로 현 정권 다른건 다 모르겠고 외교 성과는 단 하나도 없다 봅니다 저는', '중국공산당을 직접적으로 거론, 축하한건 제가 접한 뉴스로 알기로는 북한 쿠바 같은 사회주의 국가들 말고는 없어요 ㅋㅋㅋ 매우 매우 이례적인 일이라는 겁니다', '세계 반도체 2위 기업에서 경영권 승계에서 그런 일이 일어났단 건 생각안하시나요.ㅋㅋㅋ 그거에 대한 처벌은 맞다고 보는데요', '..? 그거에 대한 부분은 제가 따로 언급 안했습니다만 ㅋㅋㅋㅋㅋㅋ 현 외교 기조에서 얻어가고 있는게 하나도 없다는거 말씀드린거에요 그와중에 우리나라 삼성 수장은 잡혀갔네 아이고 푸념처럼 한 말이에요.', '쓰니 말씀대로 명절 인사한건 제가 알기로 중국어말고 영어로도 한거로 알고 있어서. 그거에 대한 불만은 없어요 다만 윗댓들 말처럼 정치인들이 우르르 저러는건 처음 봐서요 ㅋㅋㅋ 저는 다른거 다 됐고 공산당 100주년 축하 이건 정말 충격이었어요. 쉴드 불가능입니다 이건', '아니 지방정부가 중앙정부에게 인사하는게 뭐가 문제임?)실제로 한 말']"
우리나라가 원래,명절때 중국에 인사올리던 나라였냐? 아니면 요즘들어 이상해진거냐,103,"['합성이지? 제발 합성이라고 해 줘', '아니 이거 진짜임?', 'https://m.youtube.com/watch?v=XAacqGG7mAo 나도 놀라서 찾아봤는데 찐 맞음', '아 이건 좀 ㅋㅋ...', '개시발진짜 ㅋㅋ', '뭐같네 ㅋㅋㅋ', '조선시대인가,,,', 'ㅋㅋㅋㅋㅋㅋㅋㅋㅋㅋ인민망 : 중국공산당 중앙위원회의 기관지', '중국은 인사안하는데 우리니라만 하는거?', 'ㅈㄹ을 한다', '아 중국 딥페이크 기술 쩌네 ㅋㅋㅋ 제대로된 나라라면 그럴리가 없지 에이 설마', '나라down나라', 'ㅋㅋㅋㅋㅋㅋㅋㅋㅋㅋㅋㅋㅋㅋㅋㅋㅋㅋㅋㅋㅋㅋㅋㅋㅋㅋㅋㅋㅋㅋㅋㅌ미쳣갘ㅋㅋㅋ', '진짜 약 10년간 이나라 지랄이네', '착짱죽짱 ㅡㅡ', '국민들이 원하던 그림아니냐?? 걍 받아들이라고 아 ㅋㅋ', '진짜 아니지?? 제발', '씨발 제발 뻥이라고 해줘라', '다음엔 반중하는 사람 뽑는다', '조선으로 치면 명나라도 아닌것 같다... 근본없이 존나 성장한 여진족 오랑캐한테 인사 올리는 꼴 아니냐...', '명나라는 도와주기라도 했지 ㅋㅋㅋ', '진짜 ㅈ같네 ㅆㅃ', 'https://youtu.be/t22cjVPun7M', '제후국 ㅋㅋㅋㅋㅋ', '중국 속국 풀악셀 ,,', '반크에서 이거보면 자괴감 오질듯...', '제발 딥페이크라고 해줘....제발..', '진짜 더불어 찍은애들 대가리 처박아라', '박근혜는 중국어로 연설했는데 ㅋㅋㅋ', '칭화가서 학생들한테 연설 vs 공산당100주년축하+당 중진이 중국에 새해인사', '암요 박근혜 팔아서 뭐만하먼 전 정부탓 하더니 이건 또 박근혜도 하던거임 ㅋㅋ 이지랄하고있네', '정상적인 반응 : 박근혜도 ㅂㅅ이고 당 차원에서 사대질하는 민주당도 병신이다 병신같은 반응 : 박근혜도 그러던데 ㅋㅋ', '정치 논리에 뇌가 잠식당해서 우동사리만도 못한 판단력이지', '진짜 수준참담하다', '이건 좀 그렇다 굳이...?', '띠용 ㅇㅁㅇ', '괜히 참깨들이 대국소국드립치고 김치한복 자기네거라고우기겠냐ㅋㅋ 거의뭐식민지마냥 알아서 윗대가리들부터 설설기어주는데 일반국민들눈에도 참병신같이 보이는게당연하지 무시당하는게당연ㅋㅋㅋㅋ', '아.. 진짜 누가 합성했다고 말해줘.. 너무 비참하다 그냥 스스로 한국이 중국 속국 하겠다고 말하는거같아ㅠㅠ', '더불어중화당 ㅋㅋㅋㅋㅋㅋㅋ', '야 이래도 지지해? 징하다 징해', '중국에만 한거 아니지?', 'https://m.metroseoul.co.kr/article/20210212500035']"
진짜 무섭다 우리 문화 중국에 모조리 뺏길까봐,"유튜브에서 한푸, 파오차이로 검색되는 것들에다가, 정확히는 우기는 글마다 한푸 파오차이가 아니라 한복, 김치다. 라고 정정 댓글 달고있는데 도저히 극복이 안돼.

대부분의 비아시아계 외국인들은 이게 어느나라건지 상관은 없고 입은 사람이 예쁘거나 잘생기면 그냥 좋다고 나도 사고싶다고 그러고 앉았고

일부 극우 일본인들도 한국 까내리는데 동참해서 중국인들이 한국은 도둑국이다 모방국이다 이딴 댓글에다 일본인으로서 공감한다 이딴 댓글이나 쓰고있고

한국인 몇 명이 외롭게 사투중인데 절대다수는 한자를 몰라서 중국애들이 한자로 휘갈겨쓰면 해석을 못해서 반박을 못하고, 외국애들은 그거 보고 논리에서 지고 도망간걸로 생각하더라고?

엄청나게 많은 댓글에다 한푸 아니다 파오차이는 딴 음식이다 고려 고구려 한국역사다 얘기해도 그냥 벽에다 대고 읊는 것 같아

왜 우리는 이런데서 있는거지?? 왜 하필이면 이웃국가가 중국 일본이라서 호시탐탐 약탈만 당하며 살아야하지? 그와중에 정치인들이란 작자들은 대처할 생각은 안하고 어떻게든 국론 분열시켜서 지들 뒷돈 챙기는데 급급하고.

난 이제 모르겠다.... 아침에 일어나면 온통 중국어 영어로 한국X 하면서 욕 댓글 달려있겠지. 지친다. 현타도 오고.",48,"['진짜 처음에는 또 이러네 하고 웃겼는데 이제 너무 스트레스 받고 무서움. 홍콩 다음이 누구일까. 정신 차리고 우리 거 지켜야됨 진짜', '얘네 기모노도 지네꺼라고 우기고 대외적으로 칭키스칸, 몽고제국도 중국꺼라고 하는 나라임ㅋㅋ; 경계는 해야겠지만 이미 한국이 문화 강국된지 오래고 드라마, 영화 포함해서 다양한 컨텐츠 통해서 김치, 한복은 한국꺼라는 이미지 박힌지 오래되서 그렇게 심각하게 걱정할 필요는 없는 듯. 그리고 설령 중국이랑 한국이랑 이런 논쟁벌인대도 세계인이 누구 말을 믿을까 이젠? ㅎ', '근데 한국이 그동안 김치로 어그로 너무 끌어서 안먹히는듯ㅋㅋㅋ', '그냥 우리는 꾸준히 한국드라마 및 케이팝으로 김치 한복 홍보하면됨. 참고로 짱깨들 드라마중에서 한복이랑 김치 한국거라고 인정하는 영상 무수히 많음^^', '지들 문화는 문화대혁명으로 지들이 불태워서 ㅋㅋㅋ', '이거 때문에 중국어, 중국 문화 공부해서 한국 문화 지켜야겠다는 목표 생김', '개빡치는건 정부가 제대로 대응도 안함ㅅㅂ', 'ㅇㅈ 이게 젤 빡침', '근데 유튜브 채널 보면 대부분 고구려 우리나라 역사로 인식하고 있던데?']"
