피땀흘려가며 되찾은 우리 대한민국,"중꿔한테 잠식당하게 생겼다


1. 국적법 개정 반대
법무부가 국적법 개정한다는데 대상자 95%가 중국인임. 투표권 뿐만 아니라 모든 부분에서 자국민과 같은 권리를 누릴 수 있게됨- 복수 국적 인정 + 대선투표권 + 공직자 가능 + 국적포기 가능 -
지금 국내 토지 거의다 중국인들이 매입하고 있어 이러다간 먹혀
전국민이 우리나라 지켜야해 (꾸욱 눌러서 반대의견 제출해주라)
국민참여입법센터 (lawmaking.go.kr)
국적법 개정 국민청원 https://www1.president.go.kr/petitions/597991

2. 강원도 정동진 차이나드림시티 반대
강원도 정동진에도 차이나 드림시티 추진한대. 이것도 공산당이 개입하고 ( 이미 토지 매입 ) 무엇보다 근처에 우리 군부대가 있어. 계속해서 군부대 주변에도 차이나타운이 들어서고 있는데 이게 우연일까? 정말 심각하다고 생각함. 이미 우리나라에 차이나타운 30개 이상이나 있고 대림동도 조선족한테 먹힌지 오래임. 정동진 포함해서 앞으로 차이나타운은 일절 막아야해 청원+공유 부탁해
(꾸욱 눌러서 청원해줘)
강원도 정동진 차이나타운 건설을 막아주세요 > 대한민국 청와대 (president.go.kr)
https://www1.president.go.kr/petitions/598133","['근데 중국한테 이미 많이 잠식당한듯 많은 정ㅊ인들이 알고 있으면서 침묵함', '그럼 청원 한번만 도와주라', '미세먼지부터 시작해서 중국인 부동산 매매도 그렇고 세종 스마트시티나 태양광 원자재, 중국인 댓글부대도 그렇고', '난 이미 했지']",
중국,만세!!!!,"['착짱..', '타이완 남바원']",
중국이 최근 얼마나 성장했는지에 관한 책을 읽었는데,"진짜 무서울 정도로 성장했구나 느꼈어
경제 제국주의가 시작되는걸까...","['13억 너무 강력하다;;', '그래서 신냉전이 오고 있는거잖아', '무슨 책인지 알려줄 수 있으실까요.?!', '예정된 전쟁이라는 책이에용', '감사합니다 ㅎㅎ']",
ㄷㄷ 방금 중국에서 네이버 로그인됐다고 알림옴,"직접 당하니까 소름이네.
비번 바꾸고 해외로그인 차단했다.

이렇게 해킹한 아이디로 중국빠는댓글 달고 여론조작하고 하는거구나","['나도 해외로그인 차단해놓음 끔찍하다', '중화인민공화국 ㅅㅂ 짱깨 존나 토쏠려..']",
애드라 강원도 차이나타운 반대청원 동의하자,"우리나라 역사가 남아있는 유적지에 중국 관광객들을 위해 차이나타운을 만들겠대....ㅠㅠㅠㅠㅠㅠㅠㅠㅠㅠㅠㅠ이거 진짜 아닌거 같아ㅠㅠㅠㅠㅠ

https://www1.president.go.kr/petitions/597240",[],
미세먼지 504 ppm 뭔데,진짜 중국 수준의 수친데,"['와 이쪽도 394라 엄청나다고 생각했는데 더 심한 곳이 있네...', '900인 곳도 있다는거...', '미쳣다....']",
중국의 유머,펌글임,"['왜 요즘 여기저기서 중국이 보이지', '치워라 관심없다', '착짱', '그래서 짱개는 다 죽었다는 얘기임?', '중국어 해석이나 해주지 중국인만 재밋겟네', '치워']",
ㅁㅊ;; 항상 중국인들 침범엔 누가 있는지 앎??,"YG임 ㅋㅋㅋㅋㅋㅋㅋㅋㅋㅋ
이번에 간떨어지는 동거도 중국 자본이 거의 다임 ㅋㅋㅋㅋㅋㅋㅋ
중국 논란되는거 다 제작사가 YG야 진짜 미친고 아님?ㅋㅋㅋ나라까지 팔아먹고싶나","['이상하다 중국에선 약 팔면 사형인데 어케 아직 살아있지?', '솔직히 몇년전까지는 나라팔아먹는다는 단어가 안와닿았거든?? 근데 요즘 느낌.. 진짜 나라 팔아먹고싶어하는 놈들이 넘친다는거...']",
환경학과 학생으로써,중국을 안 싫어할 수가 없다 하,"['나도 별로.. -지나가던 중통-', '사실 앞에 빼도 별로긴 해', '할무니~ 책 읽어주세요~', '헐 할머니....ㅠㅜㅜ 중국발 미세먼지가 눈에 들어갔나봐요!!!']",
어이털림,"나 중통임. 바이두에서 검색할 게 있어서 앱 켰는데 임효준 기사가 딱 대놓고 나오더라고?

보나마나 한국 깔보는 기사겠지만 아무 생각 없이 눌러서 댓글 보다가 대충 이런 내용의 댓글 발견함.

중국인이 한국인으로 귀화하는 건 쉬운데, 한국인이 중국인으로 귀화하는 건 어려움. 왜인줄 암? 중국 귀화 조건은 까다로움. 귀화하기 쉬웠다간 한국인들 너도나도 하면서 중국으로 올테니까.

순간 어이가 없어서 그냥 꺼버리느라 이미지 캡처는 못하긴 했는데... 뭐 아무리 인터넷이 검열되는 사회라지만 그런거랑 별개로 저건 그냥 또라이잖아ㅋㅋㅋㅋ근데 좋아요 엄청 받았드라.

도대체 중국인들이 생각하는 외국에서의 중국은 어떤 모습인거임ㅋㅋㅋㅋㅋ? 이건 뭐 '일본 대단해'급 아님ㅋㅋㅋㅋㅋ? 도대체 왜 저딴 나라들 사이에 껴서는...","['ㅅㅂ... 거울치료아니노', 'ㅋㅋㅋㅋㅋㅋㅋㅋㅋㅋㅋㅋㅋㅋㅋ사회주의 가기싫은데..', '아닠ㅋㅋㅋ도대체 중국으로 귀화하고 싶어하는 한국인이 얼마나 될 거라고 생각하는 걸까. 우리는 공산당 눈치봐야 되는 그런 상황 드럽게 싫어요;;; 뭐만 하면 자국민들 잡아다가 코렁탕 전기구이 만드는데ㅋㅋㅋㅋ', '와 잘한다중국어..', '읭 그런가...', '한국 귀화하는 게 쉽나?? 까다롭다고 알고 있었는데 ㅋㅋㅋㅋ', '영주권은 쉬움', '귀화는 앵간히 막나가는 곳 아니면 다 까다로울 걸? 근데 중국은 까다로운게 아니라 인구 수가 감당이 안돼서 귀화 안 받는 거라고 나는 생각하는데ㅋㅋㅋㅋㅋㅋㅋ...참 대단한 애들이야.', '한국은 쉬운편이긴 함 근데 애초에 한국 사람 중에 중국 가보고 싶다는 사람은 있어도 중국에서 살고싶은 사람 있냐?ㅋㅋㅋㅋㅋㅋㅋ돈줘도 안가지 한국에서 살고싶다고 하지 전세계가 중국인이면 거부감 갖고 대하는데 그것도 모르고 쟤네 민족 단체로 도끼병 걸린게 개웃기네', 'ㅋㅋㅋㅋ원래 그래.. 자기들 똑똑하구 대단한줄알아..', '다들 자기네들 부러워하는 줄 아나봐....', 'ㅋㅋㅋㅋㅋㅋㅋㅋㅋㅋㅋㅋㅋㅋㅋㅋㅋㅋ중국 애들 개그 좀 치네?', 'ㅋㅋㅋㅋㅋㅋ배꼽킬러임', '중국인은 고갤 들어 천안문을 봐라', 'ㅋㅋㅋㅋㅋㅋㅋㅋ하...저런 것도 인류라고 봐야되나... 전국적으로 코로나랑 능지 바이러스가 퍼진 게 분명함', '중통인 애들한테 미안한 말이지만 걍 요즘 길거리에서 중국어만 들리면 걍 그 중국인 뚝배기 후려치고싶음.. 알바할때 중국인 가끔 오는데 왜 외국에 왔는데 주문할때 중국어를 쓰는걸까 그렇게 중국어 쓰고싶으면 즈그들 나라로 꺼진던가 ;;;', '나도 호텔에서 근무할 때 중국인들 영어 쓰는 거 들어본적 없음ㅋㅋㅋㅋ 중국어 가능 인원이 있어서 그런 것도 있긴 한데 해당 인원이 있든 없든 그냥 영어를 쓸 생각을 안함. 너는 어떻게 해? 중국어로 주문하면? 나같으면 중국어 모른다고 하고 막무가내로 나갈 거 같은데. 어차피 클레임도 못 걸거 아님ㅋㅋㅋ', '진짜 완전 공감이다 ㅋㅋㅋㅋㅋ 심지어 해외여행 갓을때도 나한테 중국어로 막 말하더라ㅋㅋㅋ영어 아님 한국어로 하라니까 그제서야 영어로 길 물어봄;;;', '솔직히 우리과 중 중국 좋아하는 애들 없을걸? 있으면 별종인거고.', '중통이 중국 더 싫어할듯 ㅋㅋㅋㅋㅋㅋㅋㅋㄱㅋ', '한국인 귀화 개어려움 여자 그니까 한국인아이가 있는 외국인여성이 아니면 어렵다함 그 현한국인 전터키인 알파고영상 유튭에 쳐보면 자세히 나와있음 귀화시험 문제 한국인도 통과하기 어려움', '조선족은 귀화 쉽지 않음?', '조선족은 조선족이니까 쉬운거고...', '근데 중국인이 한국 귀화하기 쉬운건 사실임. 그냥 사실만 놓고 봤을땐 쟤들말이 맞을수도? 귀화하고 싶은 국가를 떠나서', '일단 댓쓴이 말이 옳고 아니고를 떠나서 요는 귀화 난이도가 아니라 한국인(내지는 다른 나라 사람들이) 중국으로 전부 귀화할 거라는 얘기잖아...', '짱깨들은 지들이 최곤줄 알잖아 중화사상ㅋㅋ 그래봤자 이제 코로나 보유국 이미지에서 못벗어남', '에효ㅠ임효준 짱개 다됐네', '착짱죽짱', '중국 줘도 안가져...', 'ㅅㅂ 나도 알바할때 거스름돈 분명 거슬러뒀는데 500원 안거슬러 줬다고 존나 박박 우기던 중국인땜에 걍 중국인들 싫어짐 나도 중국어가 전공이지만 요즘 중국인들 하는거 보면 전공에 대한 애정도 뚝뚝 떨어짐', 'ㅁㅊ 어떻게 됐어? cctv 돌렸음?', '아니 그냥 옆에 있던 사장님이 넌덜머리 난다고 500원 걍 줘버리고 보내라고해서 마무리 됨 근데 아직도 생각하면 개빡쳐 영어로 말하려고 노력도 안하고 중국어로만 우기는게 ㅈㄴ 싫어']",
쇼트트랙 선수 임효준 선수가,"중국국적으로 귀하했다는 보도가 나왔습니다.

평창동계올림픽 금메달리스트인 그는
현재 재판 중임에도 불구하고 중국국적을 취득했다는 사실이 MBC 취재 결과 확인됐다고 합니다.

재판이 무죄 판결 날 시에 중국 대표로 베이징 올림픽에 출전할 가능성이 상당히 높다고 합니다.

+ 물론 유죄판결이 나면 이 또한 무산될 가능성이 높다고 합니다~
재판 결과를 기다려봐야겠네요.

+ 첫 재판에서는 유죄, 두번째 재판에서는 무죄판결이 난 걸로 알고 있습니다. 마지막 판결만 남아있는 상황입니다.

https://youtu.be/AOuQkwKrlZE

위 영상을 많이 참고해서 글 쓴 겁니다!!!!
모르시는 분도 많으신 것 같고
스포츠에 관심 있으신 분들은 아셔야 할 사실 같아서
이 게시판에 올립니다.

문제 될 시에 삭제하겠습니다~","['중국......', '봤는데 좀 약았다고 생각했음 ㅠ 잘못했으면 반성하면서 살아야 되는데 계속 스케이트 타고 싶어서 귀화한 걸로 보이고 또 그게 요즘 좀 문제인 중국이라니... 금메달 땄을 때 좋아했는데 좀 아닌 것 같음', '근데 대회 나가려고 국적을 진짜 바꾼거임...? 올림픽 끝나고도 계속 중국인이고 중국선수 하려는건가 ㅁㅊ 으으', '귀화하는 체육인들 솔직히 좋게 안보임. 지들욕심채우러가는거잖아. 매국노랑 다를바가 없음']",
중국 만평,"출처 RFA


진짜 중국 소비하지 말자 개개인이라도.
나는 마라탕도 한국인이 운영하는 것만 먹고 중국 자본이나 입김 들어간 철인왕후, 여신강림 일절 안 봄. 생각보다 더 심각하다",9,['마라탕은 먹는 순간 다 중국한테 돈들어가는거ㅜ 식재료가 대부분 중국 생산이라... 근데 진짜 실생활에서 중국 거르기 진짜 힘들긴 하드라... 메이드 인 차이나 아닌게 없는디ㅜㅜ']
바퀴벌레라는 말도 아깝다????,"한국에서 윤동주를 한국인이니 수정해달라고 하자

중국인이라고 절대 바꿔줄수 없다고함

그리고 일부러 한국에서 이 문제를 과장해서 민족 정서를 부추기고 있다고 함

기대를 져버리지않는 '그' 국가 ????",4,[]
중국 진짜 존나 싫다,남의 나라 문화도 자기꺼라고 우기는 것도 싫고 시끄러운것도 싫고 존나 싫어,3,['착짱죽짱..']
중국인 친구랑 동북공정 이야기했는데,"그런사람들은 약간 태극기부대처럼 질 나쁜 사람들이라 무관심이 답인데
무시하기에는 너무 그 수가 많아서 담론이 형성되어버리니 자기도 어이없고 답답하다고 하네..",2,"['조심스럽게 이런거 아니..? 하면서 김치랑 한복논란 이야기했는데 자기가 더 화내서 내가 머쓱해짐', '교환학생 갔을때 만난 중국친구랑 대화하는데 중화사상장난아님. 홍콩 대만 무조건 중국이라는 생각이 짙게 깔려있어 ㅋㅋㅋ 애초에 그친구도 유학와서 공부할정도니까 잘사는거고 상류층일텐데, 그런애들부터 중화사상 찌들어 있는거보면.. 답없음', '중화사상 찌든 애들만 유학가능함. 공산당에서 어느정도 뭐 있는거 아니면 중국에선 잘살고 유학가는거 불가능함']"
중국인 신기하긴하다,이런걸 누가먹어?라는 말이 나오는 모든걸 다처먹으니,0,"['표현좀 이쁘게 합시다', '중국인?', '한국인입니다ㅎㅎ', '저거도 많이 순화한건디..ㅜ', '네 알겠습니다!']"
요즘 중국애들 동북공정하는거 보면서 든 생각,"홍콩이나 티벳처럼 우리도 언젠가는 먹힐 것 같아.

과거부터 한국은 중국의 속국이었다, 중국의 소수민족 국가다.

중공이 해방하겠다 등 갖가지 이유를 들여서 합병할 것 같아.

얼마전 중국전통요리 유튜브에서 김치보고 자기들 전통음식이라 하질않나, 운남성 전통요리 유튜브에선 삼겹살 쌈보고 운남성 전통음식이라 하지않나

그리고 우마오당 같은 것 때문인지 걔들 댓글화력도 엄청 쎄. 중국인들은 원래 유튜브 못들어가는거 아니야? 이름이 중국냄새 나는 것들이 전부 다 '한국인은 모든게 다 자기들 것이라 한다', '한국은 중국의 문화를 받았다' 이런 소리만 하고 있어.

티벳이나 위구르 보면 중공한테 먹힌후엔 ㄹㅇ 자유를 되찾을 방법이 없을 것 같아. 일본보다 더 했으면 더 했지 덜하진 않을거야

혹시 우리학교에 한국문화 제대로 알리는 활동을 하는 동아리 같은거 없니? 중국이 은근슬쩍 우리 문화를 뺏으려 할때마다 여러나라 언어로 반박하는 글을 만들 수 있으면 좋겠어",35,"['국력이 세서 아직이긴 하지만, 제일 좋은 건 중국이 50개로 분열되는 것', '개씹극혐', '그러게요. 폴란드학과 학생이 욱일승천기 관련해서 알린 것 처럼 뭐 만들면 좋겠네요', '동북공정 처음으로 알린 교슈님이 외대 사학과 여호규 교수님입니다. 여교수님 말고도 사학과 교수님들 모두 짱짱맨이에요', '우리도 뭐 해서 외대 닉값 좀 합시다', '일본같은 애들은 그냥 짜증나기만 하는데 중국애들은 진짜 무서워 지리적으로나 문화적으로나 먹힐 것 같아서', '“중국몽”', '만약 실제로 그렇게 된다면 다른 나라에 먹힌다는거 보다 그게 중국이라는 게 너무 역겨울듷', '????=??', '진짜 역겨운 나라', '홍콩은 왜?', '짱퀴들 진짜 무섭다', '엠뒤짱']"
중국 일본 혐한 감정은,아무리 봐도 한국 잘나가서 배알꼴려서 생기는 거로 보인다,0,[]
짱개 방어 삼신기,"이거 3개면 짱개 막음 ㅋㅋㅋ
[이 글을 신고하는 사람은 티베트,위구르 등 소수민족의 독립을 찬성하며 중국의 민주화에 적극 동참하는 사람임을 알려드립니다.]",8,"['ㅋㅋ 내리시죠? 정지당하실텐데', '신고하시게요? ㄷㄷ', '막짤은 뭔가요??', '나는 중국의 천안문을 사랑해' 동요버전., '마지막사진은 머야??', '나는 중국의 천안문을 사랑해' 동요버전., '너무좋고', '근데 3번째노래 중국사람들이 만든건데 왜싫어하는거야???']"
길 알려주다가 확진자랑 접촉,이런 세상이 오게 만든 중국은 없어져야 한다.,1,['헐랭']
김치 중국산이랑 국산이랑 가격 차이 많이 나?,학교 음식에 나오는 김치 전부 중국산만 쓴다길래 좀 그래,0,"['차이 많이 나지 ㅠ 인터넷으로 봐도 같은 키로수에 만원 이상 차이남', '나는 김치는 국산일줄 알았는데 아쉽네', '원재료부터 인건비까지 품질차이가 으마무시']"
이번엔 중국인들 세종시냐...,제주도 다음은 세종...,0,"['중국인 땅 못사게 하면 안되나...', '와 진짜 싫다 그만 좀 사']"
아 진짜 중국,"진짜 맑은 하늘 좋았는데 또 시작이네..
뛰러 나가야 되는데 진짜 짜증나??",0,['ㄹㅇ 미세먼지 무슨일']
팀플 일본인이랑 하는데,얘도 중국인 못지않은 빌런이네 ㅅㅂ ㅋㅋㅋ,0,['왜']
중국: 코로나!!! BTS개새끼!!! 한복은한푸!!! 이래도 혐중안해!?,"???: 훠훠훠, 사랑합니다 중궈",0,['훠훠~ 햑생 글 내려~']
생각해보니까,"중국이 우리나라 문화를 자기들 거로 둔갑하는 거, 그거 혹시 북한 나중에 망할 때 명분 만들려고 그러는 거 아닐까? 북한 망하고 땅 처분할 때 자기네 문화권이었으니 달라고 하고, 중국의 평생 소원인 태평양 진출까지 하려고.

어차피 남한은 저렇게 문화 둔갑 같은 거 국력이 세니 타격도 안 받으니 상관 없는데 북한이라면 타격이 더 클 듯 함.",0,[]
나 중통인데,갑자기 든 생각인데 중국 정부에서 외국인도 검열이나 감시 하나...? 혹시라도 가게 됐을 때 쥐도 새도 모르게 사라지거나 추방 당하는 일은 없겠지?,0,"['중국가서 경찰서앞에서 타이완남바완 외치고 안댕기면됨. 그리고 일개 외머 학생한텐 관심없음', 'ㅋㅋㅋㅋㅋㅋㅋ하긴', '위그르인 게시물 보니까 외국인 남편도 구속됐다고 그러길래ㅋㅋㅋ', '위그르분이랑 결혼했어?', 'ㄴㄴ 그냥 이집트 국적인 인간도 잡혀들어갔다길래 허걱 이거 중국 공산당이랑 조금만 엮여도 잡혀 가는거 아냐?? 싶어서 물어본거야ㅋㅋㅋ 아무리 봐도 위그르인하고 결혼했다는 사실만으로, 그것도 다른 국적 사람을 구속했다는 게 상식적으로는 이해가 안가잖아.', '위챗쓰는데 어쩌다 한번씩 정보동의? 같은거 하라고 알람 뜸 그냥 업뎃같은거 말고 글고 그거 동의 안하면 사용 못함. 위챗은 검열한다고 공공연하게 알고 있음', '글고 중국 입국심사할때 그 지문인식인가 생체인식 ? 그거 무조건 해야 입국 가능하다고 알고 있는데 아닌가', 'ㅇㅇ맞아. 중국 앵간하면 죄다 검열하는데 뭐. 나 어렸을 때 아무것도 모르고 바이두 클라우드 쓰다가 자료 반이상 날라갔잖냐...', '그건 위구르족 탄압땜에 그런거고 우리나라 사람한테는 그럴 일 없어', '한복 한국 꺼라고 외치고 다닌다고 저렇게 되진 않겠지ㅋㅋㅋ']"
나 중통인데,"유럽어 할 걸.
ㅅㅂ 중국 개 싫다. 우리 과 중에 나만 그러냐",0,"['혐중하니까 중국어도 재미 없어짐. 배워봤자 중국인 똥꼬 빠는데나 쓸일밖에 없고.', '워 쉬 중궈런', '시진핑핑이 핑피리핑핑핑', '솔직히 학교 유학온 중국 친구들은 ㄱㅊ은거같은데 역사왜곡 한복도 자기의복이라하고 6.25전쟁 개입한게 미국의 침략으로부터 북한 지키려고한다 이런 개소리하는거 보면 싸다구마려움', '난 솔직히 우리학교 유학온 애들도 의구심 듦;;; ㅅㅂ 중공 망해라', '난 중국을 사랑해서 중국이 한 20개로 분할되었으면 좋겠어', '난 그냥 공중에서 분할되었으면 좋겠어. 아, 미세먼지 되려나', '취업할때되면 감사할거다..', '분위기 못 읽지?']"
중국게임 샤이닝니키 한국서비스 종료,"한복이 중국 옷이라는 주장으로 한국 서버에서 한복 없애더니 한국인들이 한복은 한국거라고 하니까 중국을 모욕했다면서 한국서비스 종료해버리네..;;
게다가 공지에 링크로 한복이 중국 전통의상인 이유를 설명해놨음 자세한 건 사진에 있지만 요약하자면 한국은 조선과 그 이전부터 중국의 속국이었고, 조선은 중국에 하사받은 복식을 모방한 것이기 때문에 한복은 중국 복식이다라고 주장 중.",45,"['ㄸ 이정도면 회사 입장이 아니라 사장이 잡혀갈까봐 올린 글 같은데...? “우리의 입장은 항상 조국과 일치한다는 점을 거듭 강조하고 싶습니다” 이부분도 그렇고', '고조선, 삼국시대부터 입던 걸 거듭 개량되면서 입어온 건데 먼 개솔이래', '짱개', '개소리를 존나 길게 쓰네ㅡㅡ', '아 미치놈들 무식을 티내고있네', '종료안하면 직원들 인체신비전되서그럼ㅋㅋㅋㅋㅋㅋㅋㅋ', '중국 시발놈', '그리고 얘네 러브앤프로듀서라는 다른 게임의 캐릭터 계정으로 한국 유저들 저격함ㅋㅋㅋㅋㅋㅋ', 'ㅅㅂ 이만원 썼는데 개빡치네 애플인데 환불 신청은 했는데 해줄지 모르겠다', '10만원 이내는 원래 수월하게 되지 않아? 애플응ㄴ 좀 다른가...?', '내친구 환불신청 승인됐대!', '헉 혹시 사유 뭐라고 썼대...??? 환불까지 얼마나 걸렸대...?ㅠㅜㅠㅠ', '어제 신청해서 오늘 바로 됐어 사유는 모르겠다', '사유 친구나 가족 어쩌고가 젤 빨라', '13억 떼쟁이들 ㅋㅋ', '미국옷을 입고, 미국의 기계를 사용하고, 미국의 국제기구인 UN에 가입한, 미국의 속국=중국', '치파오인가하는 뭔가는 버렸나', 'ㅅㅂ 얘네 지금 조직적으로 한복 뺏기 들어갔음', '내용은 빡치긴 한데.. 뭔가 저 살고싶어요 하고 쓰는 글 같긴 하다', '유튜브 광고 짜증났는데', '근데 이런 게임 재밌음? 존나 오글거리는데 많이들 하나봐 게다가 중국 게임인데 왜 해...??', '지금 한국 운영진이 전액 환불 해드리겠다고 공지 올렸는데 그 공지 올라온지 10분만에 지워지고 카페에 게시글 작성 불가하게 막힘+올라온 게시글들 nn개 단위로 삭제되고 있는 상태...', '맞아; 나 닠 유저인데 너무 짜증나', '요약) 중국의 속국이 될 너그들이 감히 우리말 안듣고 욕해서 괘씸해서 서비스중단합니다']"
중국인들 ㄹㅇ 미친것같음,"샤이닝니키라는 중국산 게임있는데
그 게임에서 한복 의상 게임에 내놓고 한국의상이라고 표기했는데
이거에 중국인들이 중국소수민족인 조선족의 옷인데 왜 한국으로 표기하냐고 따지고 게임삭제 인증까지 올리면서 난리남
근데 더 웃긴건 게임회사가 그거 받아들이고 사과문 올리고 중국섭에서 한복 국적 표기수정하고,
또 한국섭에선 한국현지화 차원에서 한복은 중국옷이라 부적절하다며 아예 삭제해버림
일부의 분탕이 ㅈㄹ하는거면 모르겠는데 국민과 기업과 나라가 모두 한통속으로 저러니까 ㄹㅇ답이없음 당하는 나라는 국력 차가 나니까 제대로된 항의도 못하고 그냥 중국 전체가 민족주의에 미쳐있다. 마치 세계대전 터뜨리기 직전 나치같아",41,"['그니까 ㅅㅂ지금 중국 동북공정 다시하는것같음', '착짱죽짱이라구!!', '동북공정 우리나라 역사연구소에서도 거든다는 말을 들은 거 같기도 한데', '저 기업은ㅋㅋㅋㅋ그렇게 안하면 아예 없어져버림ㅋㅋㅋㅋㅋ살기 위해서 아닌거 알아도 국가에 순응해야 하는거ㅋㅋㅋㅋ그래서 중국 공산당이 쓰레기들인거야.', '일본불매말고 중국불매나 좀 하자 일본보다 더 ㅈ같음', '아 근데 일본도 싫어ㅋㅋㅋㅋㅋㅋㅋ 하.. 주변에 쓸모있는 나라가 없네 증말', '지금 중국자본이 점점 한국 부동산 잠식중인거 알아야함.. 구로 대림쪽은 중국인건물 천지임. 미래에는 중국인한테 월세내고 살 수도 있다', '내말이... 제주도는 이제 거의 짱깨가 점령함...', '우리나라는 외국인들 부동산 거래에 제재가 없어???? 외국은 다 있잖아.', '섭종 레전드 ㅋㅋㅋㅋㅋㅋㅋㅋ', '나 니키 골수유저인데 너무 짜증나..;', '섭종공지 레전드 진짜 유사국가 수준', '섭종공지 원ㄴ래 글 안 쓰던 스탭이 갑자기 나타나서 썼는데 누가봐도 중국인이 쓴 글이어서 더 화나']"
요즘 중국,동북공정 다시시작함??? 한복 지들거라 우기는거 개에반데,2,['두루마기랑 갓도 중국거래 미친거 아니냐ㅔ']
